<?xml version="1.0" encoding="UTF-8"?>
<!--
Licensed to the Apache Software Foundation (ASF) under one
or more contributor license agreements.  See the NOTICE file
distributed with this work for additional information
regarding copyright ownership.  The ASF licenses this file
to you under the Apache License, Version 2.0 (the
"License"); you may not use this file except in compliance
with the License.  You may obtain a copy of the License at

http://www.apache.org/licenses/LICENSE-2.0

Unless required by applicable law or agreed to in writing,
software distributed under the License is distributed on an
"AS IS" BASIS, WITHOUT WARRANTIES OR CONDITIONS OF ANY
KIND, either express or implied.  See the License for the
specific language governing permissions and limitations
under the License.
-->

<service-eca xmlns:xsi="http://www.w3.org/2001/XMLSchema-instance"
        xsi:noNamespaceSchemaLocation="https://ofbiz.apache.org/dtds/service-eca.xsd">
    <eca service="testServiceEcaGlobalEventExec" event="global-commit">
        <action service="testServiceEcaGlobalEventExecOnCommit" mode="sync"/>
    </eca>
    <eca service="testServiceEcaGlobalEventExecToRollback" event="global-rollback">
        <action service="testServiceEcaGlobalEventExecOnRollback" mode="sync"/>
    </eca>

    <!-- Note: This eca is used only to allow time for the global ecas above to
            complete before the xml assertion test is run. The global commit/rollback listeners
            above run async off the transaction's afterCompletion callback and typically finish
            in a few ms, so 500ms is a wide margin - it used to be 5000ms, which by itself was a
            large share of the whole testIntegration run.
            This used to be unsafe to shorten: doing so let the main thread reach WorkEffortTests
            while those listener threads were still in flight, and their access to ServiceEcaUtil's
            then non-thread-safe ECA-rules cache raced with createWorkEffort's own rule lookup on
            the main thread, throwing a NullPointerException from java.util.LinkedList$ListItr.next()
            inside ServiceEcaUtil.evalRules. That race is fixed at the source in ServiceEcaUtil.java
            (CONFIG_LOCK plus ConcurrentHashMap/CopyOnWriteArrayList) rather than by waiting it out
            here - see that file's CONFIG_LOCK javadoc for the full mechanism - and this value is
            verified safe at 500ms across repeated testIntegration runs. -->
    <eca service="testServiceEcaGlobalEventExec" event="return">
        <set field-name="duration" value="500" format="long"/>
        <action service="blockingTestScv" mode="sync"/>
    </eca>
</service-eca>
